<?xml version='1.0' encoding='UTF-8'?>
<planets xmlns:xsi="http://www.w3.org/2001/XMLSchema-instance" xsi:noNamespaceSchemaLocation="../../schemas/planets.xsd">
  <planet id='Achilles' name='Achilles' x='308' y='408' size='30' rotate='LR' population='0' allocation='DEFAULT' autobuild='OFF' morale='50' tax='MODERATE' tax-income='0' trade-income='0'>
    <surface type='desert' id='2'/>
    <inventory/>
    <buildings/>
  </planet>
  <planet id='Andromeda 1' name='Andromeda 1' x='868' y='628' size='18' rotate='LR' owner='Ecalep' race='ecalep' population='5000' allocation='DEFAULT' autobuild='OFF' morale='50' tax='MODERATE' tax-income='0' trade-income='0'>
    <surface type='neptoplasm' id='1'/>
    <inventory/>
    <buildings/>
  </planet>
  <planet id='Andromeda 2' name='Andromeda 2' x='912' y='614' size='30' rotate='LR' owner='Ecalep' race='ecalep' population='5000' allocation='DEFAULT' autobuild='OFF' morale='50' tax='MODERATE' tax-income='0' trade-income='0'>
    <surface type='neptoplasm' id='2'/>
    <inventory/>
    <buildings/>
  </planet>
  <planet id='Andromeda 3' name='Andromeda 3' x='882' y='590' size='24' rotate='LR' owner='Ecalep' race='ecalep' population='5000' allocation='DEFAULT' autobuild='OFF' morale='50' tax='MODERATE' tax-income='0' trade-income='0'>
    <surface type='neptoplasm' id='3'/>
    <inventory/>
    <buildings/>
  </planet>
  <planet id='Andromeda 4' name='Andromeda 4' x='920' y='574' size='18' rotate='LR' population='0' allocation='DEFAULT' autobuild='OFF' morale='50' tax='MODERATE' tax-income='0' trade-income='0'>
    <surface type='neptoplasm' id='1'/>
    <inventory/>
    <buildings/>
  </planet>
  <planet id='Andromeda 5' name='Andromeda 5' x='970' y='494' size='30' rotate='RL' population='0' allocation='DEFAULT' autobuild='OFF' morale='50' tax='MODERATE' tax-income='0' trade-income='0'>
    <surface type='neptoplasm' id='4'/>
    <inventory/>
    <buildings/>
  </planet>
  <planet id='Andromeda 6' name='Andromeda 6' x='846' y='542' size='24' rotate='LR' population='0' allocation='DEFAULT' autobuild='OFF' morale='50' tax='MODERATE' tax-income='0' trade-income='0'>
    <surface type='earth' id='3'/>
    <inventory/>
    <buildings/>
  </planet>
  <planet id='Andromeda 7' name='Andromeda 7' x='974' y='588' size='18' rotate='RL' population='0' allocation='DEFAULT' autobuild='OFF' morale='50' tax='MODERATE' tax-income='0' trade-income='0'>
    <surface type='neptoplasm' id='3'/>
    <inventory/>
    <buildings/>
  </planet>
  <planet id='Center 1' name='Center 1' x='312' y='330' size='18' rotate='LR' owner='Ychom' race='ychom' population='5000' allocation='DEFAULT' autobuild='OFF' morale='50' tax='MODERATE' tax-income='0' trade-income='0'>
    <surface type='rocky' id='1'/>
    <inventory/>
    <buildings/>
  </planet>
  <planet id='Center 2' name='Center 2' x='350' y='316' size='30' rotate='RL' owner='Ychom' race='ychom' population='5000' allocation='DEFAULT' autobuild='OFF' morale='50' tax='MODERATE' tax-income='0' trade-income='0'>
    <surface type='cratered' id='8'/>
    <inventory/>
    <buildings/>
  </planet>
  <planet id='Center 3' name='Center 3' x='316' y='290' size='18' rotate='RL' owner='Ychom' race='ychom' population='5000' allocation='DEFAULT' autobuild='OFF' morale='50' tax='MODERATE' tax-income='0' trade-income='0'>
    <surface type='rocky' id='1'/>
    <inventory/>
    <buildings/>
  </planet>
  <planet id='Center 4' name='Center 4' x='278' y='302' size='24' rotate='RL' population='0' allocation='DEFAULT' autobuild='OFF' morale='50' tax='MODERATE' tax-income='0' trade-income='0'>
    <surface type='frozen' id='3'/>
    <inventory/>
    <buildings/>
  </planet>
  <planet id='Center 5' name='Center 5' x='352' y='276' size='18' rotate='LR' population='0' allocation='DEFAULT' autobuild='OFF' morale='50' tax='MODERATE' tax-income='0' trade-income='0'>
    <surface type='cratered' id='7'/>
    <inventory/>
    <buildings/>
  </planet>
  <planet id='Center 6' name='Center 6' x='298' y='250' size='24' rotate='LR' population='0' allocation='DEFAULT' autobuild='OFF' morale='50' tax='MODERATE' tax-income='0' trade-income='0'>
    <surface type='frozen' id='5'/>
    <inventory/>
    <buildings/>
  </planet>
  <planet id='Center 7' name='Center 7' x='506' y='308' size='24' rotate='LR' population='0' allocation='DEFAULT' autobuild='OFF' morale='50' tax='MODERATE' tax-income='0' trade-income='0'>
    <surface type='earth' id='7'/>
    <inventory/>
    <buildings/>
  </planet>
  <planet id='Center 8' name='Center 8' x='502' y='350' size='30' rotate='LR' population='0' allocation='DEFAULT' autobuild='OFF' morale='50' tax='MODERATE' tax-income='0' trade-income='0'>
    <surface type='desert' id='6'/>
    <inventory/>
    <buildings/>
  </planet>
  <planet id='Center 9' name='Center 9' x='540' y='332' size='30' rotate='LR' population='0' allocation='DEFAULT' autobuild='OFF' morale='50' tax='MODERATE' tax-income='0' trade-income='0'>
    <surface type='desert' id='8'/>
    <inventory/>
    <buildings/>
  </planet>
  <planet id='Center 10' name='Center 10' x='458' y='438' size='24' rotate='LR' population='0' allocation='DEFAULT' autobuild='OFF' morale='50' tax='MODERATE' tax-income='0' trade-income='0'>
    <surface type='cratered' id='5'/>
    <inventory/>
    <buildings/>
  </planet>
  <planet id='Center 11' name='Center 11' x='454' y='344' size='24' rotate='RL' population='0' allocation='DEFAULT' autobuild='OFF' morale='50' tax='MODERATE' tax-income='0' trade-income='0'>
    <surface type='desert' id='7'/>
    <inventory/>
    <buildings/>
  </planet>
  <planet id='Center 12' name='Center 12' x='196' y='318' size='24' rotate='LR' population='0' allocation='DEFAULT' autobuild='OFF' morale='50' tax='MODERATE' tax-income='0' trade-income='0'>
    <surface type='desert' id='3'/>
    <inventory/>
    <buildings/>
  </planet>
  <planet id='Center 13' name='Center 13' x='242' y='276' size='30' rotate='LR' population='0' allocation='DEFAULT' autobuild='OFF' morale='50' tax='MODERATE' tax-income='0' trade-income='0'>
    <surface type='frozen' id='5'/>
    <inventory/>
    <buildings/>
  </planet>
  <planet id='Center 14' name='Center 14' x='208' y='288' size='30' rotate='LR' population='0' allocation='DEFAULT' autobuild='OFF' morale='50' tax='MODERATE' tax-income='0' trade-income='0'>
    <surface type='earth' id='4'/>
    <inventory/>
    <buildings/>
  </planet>
  <planet id='Center 15' name='Center 15' x='112' y='358' size='24' rotate='LR' population='5000' owner='Empire' race='human' allocation='DEFAULT' autobuild='OFF' morale='50' tax='MODERATE' tax-income='0' trade-income='0'>
    <surface type='rocky' id='5'/>
    <inventory/>
    <buildings/>
  </planet>
  <planet id='Center 16' name='Center 16' x='294' y='374' size='18' rotate='LR' population='0' allocation='DEFAULT' autobuild='OFF' morale='50' tax='MODERATE' tax-income='0' trade-income='0'>
    <surface type='frozen' id='4'/>
    <inventory/>
    <buildings/>
  </planet>
  <planet id='Centronom' name='Centronom' x='252' y='382' size='30' rotate='LR' population='0' allocation='DEFAULT' autobuild='OFF' morale='50' tax='MODERATE' tax-income='0' trade-income='0'>
    <surface type='desert' id='3'/>
    <inventory/>
    <buildings/>
  </planet>
  <planet id='Earth' name='Earth' label='planets.earth' x='110' y='230' size='18' rotate='RL' population='0' allocation='DEFAULT' autobuild='OFF' morale='50' tax='MODERATE' tax-income='0' trade-income='0'>
    <surface type='earth' id='8'/>
    <inventory/>
    <buildings/>
  </planet>
  <planet id='Edgepolis' name='Edgepolis' x='108' y='306' size='30' rotate='LR' population='5000' owner='Empire' race='human' allocation='DEFAULT' autobuild='OFF' morale='50' tax='MODERATE' tax-income='0' trade-income='0'>
    <surface type='desert' id='4'/>
    <inventory/>
    <buildings/>
  </planet>
  <planet id='Exterior 1' name='Exterior 1' x='156' y='504' size='18' rotate='LR' population='5000' owner='Morgath' race='morgath' allocation='DEFAULT' autobuild='OFF' morale='50' tax='MODERATE' tax-income='0' trade-income='0'>
    <surface type='frozen' id='9'/>
    <inventory/>
    <buildings/>
  </planet>
  <planet id='Exterior 2' name='Exterior 2' x='170' y='536' size='30' owner="Morgath" race="morgath" rotate='LR' population='5000' allocation='DEFAULT' autobuild='OFF' morale='50' tax='MODERATE' tax-income='0' trade-income='0'>
    <surface type='desert' id='6'/>
    <inventory/>
	<buildings/>
  </planet>
  <planet id='Exterior 3' name='Exterior 3' x='126' y='556' size='30' rotate='RL' population='5000' owner='Morgath' race='morgath'  allocation='DEFAULT' autobuild='OFF' morale='50' tax='MODERATE' tax-income='0' trade-income='0'>
    <surface type='desert' id='8'/>
    <inventory/>
    <buildings/>
  </planet>
  <planet id='Exterior 4' name='Exterior 4' x='236' y='638' size='24' rotate='RL' population='0' allocation='DEFAULT' autobuild='OFF' morale='50' tax='MODERATE' tax-income='0' trade-income='0'>
    <surface type='rocky' id='7'/>
    <inventory/>
    <buildings/>
  </planet>
  <planet id='Exterior 5' name='Exterior 5' x='290' y='598' size='30' rotate='LR' population='0' allocation='DEFAULT' autobuild='OFF' morale='50' tax='MODERATE' tax-income='0' trade-income='0'>
    <surface type='rocky' id='4'/>
    <inventory/>
    <buildings/>
  </planet>
  <planet id='Exterior 6' name='Exterior 6' x='372' y='628' size='30' rotate='RL' population='0' allocation='DEFAULT' autobuild='OFF' morale='50' tax='MODERATE' tax-income='0' trade-income='0'>
    <surface type='cratered' id='2'/>
    <inventory/>
    <buildings/>
  </planet>
  <planet id='Exterior 7' name='Exterior 7' x='446' y='564' size='24' rotate='RL' owner="Sullep" race="sullep" population='5000' allocation='DEFAULT' autobuild='OFF' morale='50' tax='MODERATE' tax-income='0' trade-income='0'>
    <surface type='desert' id='7'/>
    <inventory/>
    <buildings/>
  </planet>